<?xml version="1.0" encoding="UTF-8" standalone="yes"?>
<defaultScene  xsi:schemaLocation="schema1.xsd" xmlns:xsi="http://www.w3.org/2001/XMLSchema-instance">
    <name>default</name>
    <rootNode>
        <name>root</name>        
        <children xmlns:xsi="http://www.w3.org/2001/XMLSchema-instance" xsi:type="Light">
            <location>
                <x>500.2</x>
                <y>500.2</y>
                <z>500.2</z>
            </location>
            <xrot>0.0</xrot>
            <yrot>0.0</yrot>
            <zrot>0.0</zrot>
            <index>16385</index>
            <ambient>            	
                <x>1.0</x>
                <y>1.0</y>
                <z>1.0</z>
                <w>1.0</w>
            </ambient>
            <diffuse>
                <x>1.0</x>
                <y>1.0</y>
                <z>1.0</z>
                <w>1.0</w>
            </diffuse>
            <specular>
                <x>1.0</x>
                <y>1.0</y>
                <z>1.0</z>
                <w>1.0</w>
            </specular>
        </children>
        <children xmlns:xsi="http://www.w3.org/2001/XMLSchema-instance" xsi:type="Plane">
            <location>
                <x>-100.0</x>
                <y>-1.0</y>
                <z>-100.0</z>
            </location>
            <xrot>0.0</xrot>
            <yrot>0.0</yrot>
            <zrot>0.0</zrot>
            <textureLocation>textures/tex1.png</textureLocation>
            <textured>true</textured>
            <size>200.0</size>
            <textureScale>4.0</textureScale>
        </children>
        <children xmlns:xsi="http://www.w3.org/2001/XMLSchema-instance" xsi:type="Box">
            <name>box</name>
            <location>
                <x>0.0</x>
                <y>0.0</y>
                <z>0.0</z>
            </location>
            <xrot>0.0</xrot>
            <yrot>0.0</yrot>
            <zrot>0.0</zrot>
            <textureLocation>textures/tex2.png</textureLocation>
            <textured>true</textured>
        </children>
        <children xmlns:xsi="http://www.w3.org/2001/XMLSchema-instance" xsi:type="Box">
            <name>box</name>
            <location>
                <x>4.0</x>
                <y>0.0</y>
                <z>0.0</z>
            </location>
            <xrot>0.0</xrot>
            <yrot>15.0</yrot>
            <zrot>0.0</zrot>
            <textureLocation>textures/tex2.png</textureLocation>
            <textured>true</textured>
        </children>
        <children xmlns:xsi="http://www.w3.org/2001/XMLSchema-instance" xsi:type="Box">
            <name>box</name>
            <location>
                <x>4.0</x>
                <y>0.0</y>
                <z>4.0</z>
            </location>
            <xrot>0.0</xrot>
            <yrot>65.0</yrot>
            <zrot>0.0</zrot>
            <textureLocation>textures/tex2.png</textureLocation>
            <textured>true</textured>
        </children>                 
        <location>
            <x>0.0</x>
            <y>0.0</y>
            <z>0.0</z>
        </location>
        <xrot>0.0</xrot>
        <yrot>0.0</yrot>
        <zrot>0.0</zrot>
    </rootNode>
    <currentCameraIndex>0</currentCameraIndex>
    <cameras>
        <name>cam1</name>
        <position>
            <x>0.0</x>
            <y>5.0</y>
            <z>-10.0</z>
        </position>
        <view>
            <x>0.0</x>
            <y>0.0</y>
            <z>0.0</z>
        </view>
        <upVector>
            <x>0.0</x>
            <y>1.0</y>
            <z>0.0</z>
        </upVector>
        <strafe>
            <x>-1.0</x>
            <y>0.0</y>
            <z>0.0</z>
        </strafe>
        <mode>FLY</mode>
    </cameras>
    <cameras>
        <name>cam2</name>
        <position>
            <x>0.0</x>
            <y>5.0</y>
            <z>-10.0</z>
        </position>
        <view>
            <x>0.0</x>
            <y>0.0</y>
            <z>0.0</z>
        </view>
        <upVector>
            <x>0.0</x>
            <y>1.0</y>
            <z>0.0</z>
        </upVector>
        <strafe>
            <x>-1.0</x>
            <y>0.0</y>
            <z>0.0</z>
        </strafe>
        <mode>FLY</mode>
    </cameras>
    <cameras>
        <name>cam3</name>
        <position>
            <x>0.0</x>
            <y>5.0</y>
            <z>-10.0</z>
        </position>
        <view>
            <x>0.0</x>
            <y>0.0</y>
            <z>0.0</z>
        </view>
        <upVector>
            <x>0.0</x>
            <y>1.0</y>
            <z>0.0</z>
        </upVector>
        <strafe>
            <x>-1.0</x>
            <y>0.0</y>
            <z>0.0</z>
        </strafe>
        <mode>FLY</mode>
    </cameras>
</defaultScene>
